{
  "date": "2026-10-11",
  "generated_at": "2026-10-11T08:10:49+09:00",
  "period": { "from": "2026-10-10", "to": "2026-10-11" },
  "overview_ko": "수집 기간(10월 10~11일, 토·일)에 새로 확인된 해외 기사는 없다. World Nuclear News·ANS Nuclear Newswire·NucNet의 최신 게재물은 모두 10월 9일자 이전이고 전건 직전 브리핑에 이미 실렸다. 수집 경로가 막혀서 비어 있는 것은 아니다 — RSS 피드 6종, ANS 목록 페이지, TED 검색 API(전문검색 10종), UK Find a Tender OCDS API, 현지어 검색을 모두 돌려 '기간 내 신규 0건'을 확인했다. 다만 Nuclear Engineering International 피드는 6월 16일자에서 멈춰 있어 수집 실패로 기록했다. 영업 관점: 이번 회차에 새로 대응할 사건은 없고, 주 초 유럽 공공조달 공고가 재개되므로 다음 회차에서 신규 공고를 다시 확인한다.",
  "overview_en": "No new overseas stories surfaced in the 10-11 October window, a Saturday and Sunday. The latest items from World Nuclear News, ANS Nuclear Newswire and NucNet all predate 9 October and were already carried in the previous briefing. This is an empty window rather than a blocked one: six RSS feeds, the ANS listing page, the TED search API (ten full-text terms), the UK Find a Tender OCDS API and the local-language searches were all run and all returned nothing new for the period. One source did fail - the Nuclear Engineering International feed is stuck at 16 June. Sales angle: nothing new to act on this cycle; European public procurement resumes at the start of the week, so the next run re-checks for fresh notices.",
  "domestic_overview_ko": "특이 동향 없음. 정책브리핑(korea.kr)을 '원전'·'SMR'·'원자력' 세 가지로 검색한 결과 최신 게재물은 10월 8일자이고 기간 내 신규 원자력 보도자료는 없다. 한국수력원자력 보도자료 게시판 최신 글은 10월 7일자, 한국전력 보도·설명자료는 10월 8일자이며 모두 행사·수상 등 홍보성 단신이거나 원자력과 무관하다. 더구루·더트래커 피드에서 원전·SMR·한수원·한전 키워드로 걸러낸 항목도 전건 기존 브리핑에 실린 건이었다(더트래커 피드는 10월 8일자에서 갱신이 멈춰 있다). 영업 관점: 국내발 새 변수 없음.",
  "domestic_overview_en": "Nothing of note. Searching the government press-briefing portal (korea.kr) on all three terms - nuclear plants, SMR and nuclear energy - returns nothing newer than 8 October, with no nuclear releases inside the window. The newest post on KHNP's press board is 7 October and KEPCO's is 8 October, all either promotional items (events, awards) or unrelated to nuclear. Items filtered from the TheGuru and TheTracker feeds on the KHNP/KEPCO/nuclear/SMR keywords had all been carried in earlier briefings, and the TheTracker feed has not refreshed since 8 October. Sales angle: no new domestic variables.",
  "countries_pulse": [],
  "articles": []
}
